{
  "schema_version": 2,
  "game_id": "dirilis_last_march",
  "generated_at": "2026-08-27T23:03:25Z",
  "timeline": {
    "start_year_gregorian": 1227,
    "end_year_gregorian": 1261,
    "note": "v1 (1225-1226) dan ko'chirildi: Bayju Noyan 1241-da tayinlangan, Köse Dağ 1243, Köpek terrori 1237-38, Ibn Arabiy 1223-dan Damashqda. Bu ko'chirish 11 ta anaxronizmning 9 tasini hal qiladi."
  },
  "seasons": [
    {
      "id": "S1",
      "index": 1,
      "loc_key_title": "season.s1.title",
      "codename": "SARHAD",
      "year_from": 1227,
      "year_to": 1230,
      "setting": "autumn",
      "tier_range": [
        1,
        2
      ],
      "boss": "CHR_TITUS",
      "region": "Amanos / Halab / Sham",
      "new_enemy_archetype": "Templar sержant + arbaletchi",
      "world_change": "Janub yopiladi, Konya mintaqasi ochiladi",
      "episode_ids": [
        "EP001",
        "EP002",
        "EP003",
        "EP004",
        "EP005",
        "EP006",
        "EP007",
        "EP008",
        "EP009",
        "EP010",
        "EP011",
        "EP012"
      ]
    },
    {
      "id": "S2",
      "index": 2,
      "loc_key_title": "season.s2.title",
      "codename": "SULTON_SOYASI",
      "year_from": 1230,
      "year_to": 1238,
      "setting": "summer",
      "tier_range": [
        3,
        4
      ],
      "boss": "CHR_KOPEK",
      "region": "Konya / Kubadabad / Erzincan",
      "new_enemy_archetype": "Xorazmiy nayzachi + saroy qotili",
      "world_change": "Jang tizimi qayta yoziladi (chap qo'l). Mo'g'ul mintaqasi ochiladi",
      "episode_ids": [
        "EP013",
        "EP014",
        "EP015",
        "EP016",
        "EP017",
        "EP018",
        "EP019",
        "EP020",
        "EP021",
        "EP022",
        "EP023",
        "EP024"
      ]
    },
    {
      "id": "S3",
      "index": 3,
      "loc_key_title": "season.s3.title",
      "codename": "QORA_BULUT",
      "year_from": 1238,
      "year_to": 1243,
      "setting": "winter",
      "tier_range": [
        4,
        5
      ],
      "boss": "CHR_BAIJU",
      "region": "Sharqiy Anadolu / Erzurum / Köse Dağ",
      "new_enemy_archetype": "Mo'g'ul otliq kamonchi + nerge",
      "world_change": "Saljuqiy vassal. Sharq yopiladi, G'arb (Söğüt) ochiladi",
      "episode_ids": [
        "EP025",
        "EP026",
        "EP027",
        "EP028",
        "EP029",
        "EP030",
        "EP031",
        "EP032",
        "EP033",
        "EP034",
        "EP035",
        "EP036"
      ]
    },
    {
      "id": "S4",
      "index": 4,
      "loc_key_title": "season.s4.title",
      "codename": "SONGGI_YURISH",
      "year_from": 1243,
      "year_to": 1261,
      "setting": "full_cycle",
      "tier_range": [
        4,
        5
      ],
      "boss": "CHR_BAIJU",
      "region": "Söğüt / Domaniç / Vizantiya chegarasi",
      "new_enemy_archetype": "Keshikten + qamal mashinasi",
      "world_change": "O'yin tugaydi. NG+ (Xronika rejimi) ochiladi",
      "episode_ids": [
        "EP037",
        "EP038",
        "EP039",
        "EP040",
        "EP041",
        "EP042",
        "EP043",
        "EP044",
        "EP045",
        "EP046",
        "EP047",
        "EP048"
      ]
    }
  ],
  "episodes": [
    {
      "id": "EP001",
      "season_id": "S1",
      "global_index": 0,
      "season_index": 0,
      "loc_key_title": "ep.ep001.title",
      "loc_key_synopsis": "ep.ep001.synopsis",
      "loc_key_cliffhanger": "ep.ep001.cliffhanger",
      "anchor": {
        "hijri": "624 Ramazon",
        "gregorian": "1227 Avgust",
        "year_gregorian": 1227,
        "confidence": "DOCUMENTED",
        "loc_key_note": "ep.ep001.history_note"
      },
      "intro": {
        "archetype": "WALK",
        "duration_sec": 180,
        "date_display": "OVERLAY",
        "loc_key_description": "ep.ep001.intro",
        "allow_movement": true,
        "allow_combat": false,
        "director_camera_weight_max": 0.35
      },
      "archetype": "INVESTIGATION",
      "difficulty_tier": 1,
      "estimated_minutes": 50,
      "objectives": [
        {
          "id": "OBJ_OCH_QARGALAR_MAIN",
          "loc_key": "ep.ep001.obj.main",
          "kind": "INVESTIGATE",
          "optional": false,
          "scripted_failure": false
        }
      ],
      "enemy_composition": {
        "archetypes": {},
        "max_simultaneous": 0,
        "background_agents": 0
      },
      "traversal": [
        "FOOT_PARKOUR",
        "HORSE"
      ],
      "mechanics_introduced": [],
      "mih_beat": {
        "kind": "OBJECT",
        "loc_key": "ep.ep001.mih",
        "tag": "Mih.Beat.Object",
        "is_major": false
      },
      "wound_state": {
        "phase": "INTACT",
        "expected_integrity_at_start": 100.0,
        "max_integrity": 100.0,
        "drain_multiplier": 1.0,
        "parry_window_ms": 180.0
      },
      "codex_unlocks": [
        "CDX_TOPAK_EV",
        "CDX_YAYLAK_KISLAK",
        "CDX_KAYI_TRIBE"
      ],
      "prerequisites": [],
      "unlocks": [
        "EP002"
      ],
      "checkpoints": [
        "CP_EP001_INTRO_END",
        "CP_EP001_MID",
        "CP_EP001_FINALE"
      ],
      "fail_conditions": [
        "Fail.PlayerDeath"
      ],
      "world_state_deltas": [
        "Episode.EP001.Completed"
      ],
      "levels": [
        "LVL_OCH_QARGALAR"
      ],
      "characters": [
        "CHR_ERTUGRUL"
      ],
      "environment": {
        "season": "autumn",
        "time_of_day": "day",
        "weather": "clear",
        "region": "Anadolu chegarasi"
      },
      "audio": {
        "music_cue": "MUS_EP001",
        "ambience_tag": "Ambience.Autumn.Clear",
        "silence_scene": false
      },
      "telemetry": {
        "funnel_id": "funnel_ep001",
        "target_completion_pct": 96.0,
        "watch_metrics": [
          "deaths",
          "duration",
          "abandon_point"
        ]
      },
      "content": {
        "warnings": [],
        "has_torture_scene": false
      },
      "retention_hook": "ep.ep001.teaser"
    },
    {
      "id": "EP002",
      "season_id": "S1",
      "global_index": 1,
      "season_index": 1,
      "loc_key_title": "ep.ep002.title",
      "loc_key_synopsis": "ep.ep002.synopsis",
      "loc_key_cliffhanger": "ep.ep002.cliffhanger",
      "anchor": {
        "hijri": "624 Shavvol",
        "gregorian": "1227 Sentabr",
        "year_gregorian": 1227,
        "confidence": "DOCUMENTED",
        "loc_key_note": "ep.ep002.history_note"
      },
      "intro": {
        "archetype": "WALK",
        "duration_sec": 120,
        "date_display": "DIEGETIC",
        "loc_key_description": "ep.ep002.intro",
        "allow_movement": true,
        "allow_combat": false,
        "director_camera_weight_max": 0.35
      },
      "archetype": "ESCORT",
      "difficulty_tier": 1,
      "estimated_minutes": 55,
      "objectives": [
        {
          "id": "OBJ_IKKI_ASIR_MAIN",
          "loc_key": "ep.ep002.obj.main",
          "kind": "ESCORT",
          "optional": false,
          "scripted_failure": false
        }
      ],
      "enemy_composition": {
        "archetypes": {
          "Enemy.Crusader.Scout": 4
        },
        "max_simultaneous": 4,
        "background_agents": 0
      },
      "traversal": [
        "HORSE",
        "FOOT_PARKOUR"
      ],
      "mechanics_introduced": [],
      "mih_beat": {
        "kind": "ON_OTHER",
        "loc_key": "ep.ep002.mih",
        "tag": "Mih.Beat.OnOther",
        "is_major": false
      },
      "wound_state": {
        "phase": "INTACT",
        "expected_integrity_at_start": 100.0,
        "max_integrity": 100.0,
        "drain_multiplier": 1.0,
        "parry_window_ms": 180.0
      },
      "codex_unlocks": [
        "CDX_COMPOSITE_BOW",
        "CDX_JALALADDIN",
        "CDX_REFUGEE_CRISIS"
      ],
      "prerequisites": [
        "EP001"
      ],
      "unlocks": [
        "EP003"
      ],
      "checkpoints": [
        "CP_EP002_INTRO_END",
        "CP_EP002_MID",
        "CP_EP002_FINALE"
      ],
      "fail_conditions": [
        "Fail.PlayerDeath",
        "Fail.EscortLost"
      ],
      "world_state_deltas": [
        "Episode.EP002.Completed"
      ],
      "levels": [
        "LVL_IKKI_ASIR"
      ],
      "characters": [
        "CHR_ERTUGRUL"
      ],
      "environment": {
        "season": "autumn",
        "time_of_day": "day",
        "weather": "clear",
        "region": "O'rmon"
      },
      "audio": {
        "music_cue": "MUS_EP002",
        "ambience_tag": "Ambience.Autumn.Clear",
        "silence_scene": false
      },
      "telemetry": {
        "funnel_id": "funnel_ep002",
        "target_completion_pct": 94.5,
        "watch_metrics": [
          "deaths",
          "duration",
          "abandon_point"
        ]
      },
      "content": {
        "warnings": [],
        "has_torture_scene": false
      },
      "retention_hook": "ep.ep002.teaser"
    },
    {
      "id": "EP003",
      "season_id": "S1",
      "global_index": 2,
      "season_index": 2,
      "loc_key_title": "ep.ep003.title",
      "loc_key_synopsis": "ep.ep003.synopsis",
      "loc_key_cliffhanger": "ep.ep003.cliffhanger",
      "anchor": {
        "hijri": "624 Zulqada",
        "gregorian": "1227 Oktabr",
        "year_gregorian": 1227,
        "confidence": "DOCUMENTED",
        "loc_key_note": "ep.ep003.history_note"
      },
      "intro": {
        "archetype": "PLUNGE",
        "duration_sec": 180,
        "date_display": "OVERLAY",
        "loc_key_description": "ep.ep003.intro",
        "allow_movement": true,
        "allow_combat": false,
        "director_camera_weight_max": 0.35
      },
      "archetype": "DEFENSE",
      "difficulty_tier": 1,
      "estimated_minutes": 50,
      "objectives": [
        {
          "id": "OBJ_OQ_PLASH_MAIN",
          "loc_key": "ep.ep003.obj.main",
          "kind": "HOLD",
          "optional": false,
          "scripted_failure": false
        }
      ],